qid	answer	tigan	o1	p1	o2	p2	o3	p3	tail
451	2	甲為自用小客車駕駛人，乙為營業大貨車職業駕駛人。兩人一年內均有2次闖紅燈紀錄，依 115年新制，下列敘述何者正確？	(1)	甲、乙均已達三項指定違規之累計門檻，兩人皆須參加矯正防制班。	(2)	甲尚未達門檻暫免參加；乙因營業大型車適用較低門檻，須參加矯正防制班。	(3)	甲、乙門檻相同皆為3次，兩人目前均為2次，尚未達標，暫無須參加。	
452	1	根據115年3月31日起實施之新制，關於駕駛人須參加矯正防制班講習，下列敘述何者正確？	(1)	汽機車駕駛人於一年內，違反闖紅燈行為累計達三次者。	(2)	汽機車駕駛人於兩年內，因不 同交通違規行為累計記點達12點者。	(3)	營業大型車駕駛人於一年內，闖紅燈行為達一次者。	
453	2	自115年3月31日起，營業大型車職業駕駛人1年內闖紅燈違規達幾次者，即應自費參加道路交通安全講習？	(1)	1次。	(2)	2次。	(3)	3次。	
454	3	115年3月31日起，營業大型車職業駕駛人應納入道安講習對象之特定違規行為？	(1)	無號誌路口未依路權行駛。	(2)	行近未設行車管制號誌之行人穿越道、醫院及學校等未依規定減 速。	(3)	以上皆是。	
455	2	汽車駕駛人行至設有「右轉彎專用車道」的交岔路口，準備執行右轉。下列哪一項行為最符合 法規並能體現「主動停讓」精神？	(1)	若前方直行車道回堵，可以先占用右轉專用車道直行，再切回主線。	(2)	應依規定進入右轉專用車道，並在轉彎時減速，並暫停讓行人穿越道線上的 行人先行。	(3)	只要右轉燈號亮起，轉彎車即擁有優先路權，不須理會已進入路口的行人。	
456	3	大型車接近行人穿越道，行人尚未踏入但有通行意圖時，下列何者正確？	(1)	行人未進入可先行通過。	(2)	鳴喇叭提醒行人後再行通過。	(3)	應減速並準備隨時停車，禮讓行人優先。	
457	1	汽車駕駛人行近路口，未停讓行人穿越道上行人先行通過者，以下何者為錯誤？	(1)	因而肇事致人重傷或死亡者，記違規點數2點。	(2)	處新臺幣1,200元至6,000元罰鍰。	(3)	不讓攜帶 白色手杖或導盲犬之視障者先行通過,處新臺幣2,400元至7,200元罰鍰。	
458	1	汽車駕駛人在路口看到綠燈亮起準備左轉，此時行人穿越道線上仍有行人正緩慢過馬路，下列 行為何項正確？	(1)	在行人前方約3公尺處停車，保持完全靜止直到行人通過。	(2)	緩慢滑行靠近行人，趁行人過到分向線，可從行人後方加速穿越。	(3)	只要行人還沒走進自己的行車路徑， 就可以維持車速轉彎。	
459	3	行經無號誌且未劃分支幹道的路口時，若汽車駕駛人要左轉，而對向有一輛右轉車同時要進入同一個車道，以下敘述何者正確？	(1)	體積較大的車輛優先通行，體積小的應禮讓。	(2)	左轉 彎車應禮讓右轉彎車先行。	(3)	右轉彎車應禮讓左轉彎車先行。	
460	3	在無號誌交岔路口，橫線有分向標線、縱線未劃設分向標線，但同為雙向各有1車道之道路，兩車皆為轉彎車，請問要如何行駛？	(1)	行駛於未劃設分向標線者應停讓有分向標線者先行。	(2)	少線道車應主動停讓多線道車先行。	(3)	左方車應停讓右方車先行。	
461	2	夜間遇到前方有行人穿越時，應該怎麼做？	(1)	切換遠光燈提醒行人，減速確認安全後再通過。	(2)	維持近光燈，減速確認安全後再通過。	(3)	維持近光燈並保持速度通過。	
462	2	汽車駕駛人在多車道路段行駛，準備在路口左轉。下列哪一種駕駛行為是錯誤且具有危險性？	(1)	進入路口中心點處再行轉彎，不占用對向車道。	(2)	從外側第二車道直接「大迴轉」或橫跨 車道左轉。	(3)	在設有左轉專用道時，提早切換進入專用道等候。	
463	3	汽車駕駛人行至交岔路口，遇前車停等禮讓行人時，以下何者正確？	(1)	自後方變換車道，繞過前車直接通過路口。	(2)	猛按喇叭催促前車。	(3)	依序停等，禮讓行人先通過。	
464	3	汽車駕駛人，駕駛汽車行近行人穿越道或其他依法可供行人穿越之交岔路口，不暫停讓行人先行通過，因而肇事致人受傷者，處新臺幣18,000～36,000元罰鍰，且其駕駛執照：	(1)	吊銷。	(2)	吊扣6個月～1年。	(3)	吊扣1～2年。	
465	3	汽車行經未劃設行人穿越道之交岔路口，遇有行人穿越時，應如何處理？	(1)	按鳴喇叭示意行人快速通過。	(2)	減速慢行，並視情況保持距離通過。	(3)	無論有無交通指揮人員指揮或號 誌指示，均應暫停讓行人優先通過。	
466	2	行至路口遇閃光紅燈號誌時，駕駛人應：	(1)	減速接近，確認安全後，小心通過。	(2)	應先停止於停止線前，觀察左右無來車或行人後，方得起步。	(3)	閃光紅燈與閃光黃燈路權相同，不 須停讓。	
467	3	汽車駕駛人，駕駛汽車行近行人穿越道或其他依法可供行人穿越之交岔路口，遇有攜帶白手杖或導盲犬之視覺功能障礙者時，不暫停讓其先行通過者，處新臺幣：	(1)	600-1,800元罰鍰。	(2)	1,200-6,000元罰鍰。	(3)	2,400-7,200元罰鍰。	
468	1	汽車行近行人穿越道前，應如何落實停讓觀念？	(1)	應減速慢行，遇有行人穿越時應暫停。	(2)	若行人還在路邊等待，就儘速通過。	(3)	當行人距離車輛一條車道寬時，可以不減速通 過。	
469	1	行經設有「行人優先區」起點標誌之區域或巷道，汽車駕駛人應：	(1)	減速慢行，並隨時準備暫停讓行人先行通過。	(2)	按鳴喇叭提醒行人小心。	(3)	只要行人沒擋路，可照常車速行 駛。	
470	3	駕駛人行近行人穿越道未依規定停讓行人，導致行人受傷或死亡，其法律責任為何？	(1)	須繳納罰鍰並參加講習。	(2)	罰鍰並吊扣駕駛執照1至2年。	(3)	罰鍰、吊扣/吊銷其駕駛執照， 依法負刑事責任，並加重其刑至二分之一。	
471	2	轉彎車行經路口遇有行人時，正確的防禦駕駛觀念是：	(1)	減速先轉過去，再讓車頭前的行人先通過。	(2)	暫停並確認A柱及照後鏡死角後，讓行人完全通過後再起步。	(3)	按鳴喇叭，提 醒行人注意來車。	
472	3	若路口已顯示綠燈，但行人穿越道上仍有尚未走完之行人，應如何處理？	(1)	綠燈已亮，可緩慢接近行人提醒。	(2)	繞過行人加速通過。	(3)	持續暫停，待其安全通過後再起步。	
473	3	汽車行駛至交岔路口遇綠燈亮起時，關於通過路口之方式，下列敘述何者較為正確？	(1)	綠燈 表示允許通行，如行人穿越道有行人可按鳴喇叭警示後通過。	(2)	綠燈時行人依規定不得穿越，故駕駛人可依號誌指示正常通過。	(3)	綠燈時仍應注意路口動態，如有行人穿越應讓其先 行。	
474	3	接近設有行人穿越道的路口時，駕駛人應如何處置？	(1)	行人尚未踏入穿越道即可加速通過。	(2)	只要號誌綠燈即可通行。	(3)	應減速並隨時準備停車讓行人優先。	
475	1	建立「路口停讓文化」對於道路安全的終極目標是：	(1)	建立以人為本、互相尊重的安全環境。	(2)	增加政府稅收。	(3)	讓駕駛人開車不便，以減少道路交通量。	
476	3	汽車行經以下交岔路口應依規定停讓，何者不正確？	(1)	設有停車再開標誌、停標字之交岔路口。	(2)	閃光紅燈號誌之交岔路口。	(3)	閃光黃燈號誌之交岔路口。	
477	2	「防禦駕駛」在路口最重要的觀念是？	(1)	爭取優先路權。	(2)	預測他人可能違規。	(3)	速度越快越安全。	
478	2	汽車準備右轉彎前，應於多少距離前換入最右側車道並顯示方向燈？	(1)	10公尺。	(2)	30公尺。	(3)	到達路口再換。	
479	2	汽車行近未設行車管制號誌之行人穿越道時，關於駕駛人應有之行為，下列敘述何者正確？	(1)	確認穿越道上無行人時，得維持原速通過。	(2)	無論穿越道上有無行人，均應減速慢行接 近。	(3)	行人尚未踏入穿越道前，車輛具有優先通行權。	
480	1	「行走行人」之綠色燈號閃光顯示時，表示：	(1)	警告行人，剩餘之綠燈時間不多，尚未進入道路者，避免跨入；已進入道路者，應儘速通過，或停止於道路中之交通島上。	(2)	行人可穿越道 路。	(3)	行人禁止進入道路。	
481	3	在路口遇大型車輛右轉時，小型車應如何應對？	(1)	從右側快速通過。	(2)	靠近大型車行駛避免被插隊。	(3)	行駛大型車後方並保持距離，避免進入內輪差範圍。	
482	3	在無號誌、無標誌且路權相同的路口，兩車均為直行車且同時到達，應如何通行？	(1)	先按鳴喇叭者優先。	(2)	大型車優先通行。	(3)	左方來車讓右方來車先行。	
483	1	有關行車速度，依速限標誌或標線之規定，無速限標誌或標線者，下列敘述何者錯誤？	(1)	行 車時速不得超過50公里，設有快慢車道分隔線之慢車道亦同。	(2)	未劃設車道線、行車分向線或分向限制線之道路，時速不得超過30公里。	(3)	行經設有彎道、隧道、學校、醫院標誌 之路段、無號誌之交岔路口及其他人車擁擠處所，均應減速慢行，作隨時停車之準備。	
484	2	兩輛汽車從不同方向，同時抵達無號誌路口且進入路口行向車道數相同，關於通行的優先權，下列何者正確？	(1)	左方為直行車，右方為轉彎車，左方車應讓右方車先行。	(2)	兩車均為直 行車，左方車應讓右方車先行。	(3)	兩車均為直行車，右方車應讓左方車先行。	
485	2	駕駛人在路口進行「擺頭察看」動作，其主要目的是：	(1)	舒緩頸部疲勞。	(2)	避免車輛A柱遮蔽視線所造成視覺死角，確認有無行人。	(3)	讓警察知道我有看路，避免罰單。	
486	2	接近路口時號誌由綠轉黃，最安全且合法的作法為何？	(1)	加速通過路口避免紅燈。	(2)	前輪如尚未通過停止線，停止通過路口。	(3)	一律緊急煞車停車。	
487	3	下列哪一種情形在交通法規中不屬於「闖紅燈」的定義？	(1)	號誌剛轉為紅燈，仍加速穿越路口。	(2)	紅燈亮起時，汽車穿越停止線至行人穿越道上停等。	(3)	黃燈亮起時，車身已完全 通過停止線。	
488	3	汽車駕駛行經交岔路口遇紅燈亮起時，前輪通過停止線煞停在行人穿越道上，是否屬闖紅燈行為？	(1)	只要沒有把車開過路口就不算。	(2)	雖然前輪越過停止線，但只要停住就不算。	(3)	視為闖紅燈。	
489	3	關於闖紅燈之違規認定標準，下列敘述何者錯誤？	(1)	車輛面對紅燈亮起後，仍超越停止線至 銜接路段，含左轉、直行、迴轉及右轉（依箭頭綠燈允許行駛者除外）。	(2)	車輛面對紅燈亮起後，車身仍超越停止線並足以妨害其他方向人（若有行人穿越道）、車通行。	(3)	車輛面對 號誌非為紅燈時，已超越停止線。	
490	2	車輛面對紅燈亮起後，車身仍超越停止線，下列敘述何者錯誤？	(1)	若足以妨害其他方向人（有行人穿越道）、車通行視同闖紅燈。	(2)	只要不侵入行人穿越道，則不會受罰。	(3)	若僅 前輪超越停止線者，則視為「不遵守標線指示」。	
491	2	汽車駕駛人行經有燈光號誌管制之交岔路口，在無箭頭導向燈號之狀況下，闖紅燈而左轉或右轉應處罰下列何者錯誤：	(1)	右轉彎不依標誌、標線、號誌指示。	(2)	闖紅燈。	(3)	併罰轉彎不依 標誌、標線、號誌指示及闖紅燈。	
492	2	汽車駕駛人跟隨大型車後方，因視線受阻未察燈號轉紅而通過停止線進入路口繼續行駛，下列何者正確？	(1)	因視線被遮蔽不具故意行為，應予免罰。	(2)	應負「闖紅燈」之違規責任。	(3)	應由前方大型車負擔視線阻擋之違規責任。	
493	1	號誌故障之路口，經現場依法令執行指揮交通之人員指揮前進時，其效力為何？	(1)	指揮人員手勢優於號誌，聽從指揮前行合法。	(2)	應以燈號顯示紅燈為準，否則視同闖紅燈。	(3)	駕駛 人應根據車流自行判斷，手勢僅具建議性質。	
494	2	汽車左轉時，若超越停止線前燈號已轉換為紅燈，下列敘述何者正確？	(1)	屬「左轉彎未依規定」，處新臺幣 600 元罰鍰。	(2)	屬「闖紅燈」，因其超越停止線瞬間燈號為紅燈。	(3)	視為 「路口餘裕通行」，不予處罰。	
495	2	汽車駕駛人因避讓執行任務之消防車而越線闖紅燈，關於其處置程序下列何者正確？	(1)	避讓後逕行駛離路口，不予理會罰單。	(2)	應在安全避讓後儘速靜止，若遭檢舉可檢具事實申訴撤 單。	(3)	應加速通過路口，以利消防車前進。	
496	1	汽車行至無號誌路口，支線道車輛遇幹線道車輛時，其通行權規定下列何者正確？	(1)	支線道車應禮讓幹線道車先行。	(2)	視雙方車速而定，車速較快者先行。	(3)	只要幹線道車輛尚遠， 支線道車可直接通過路口。	
497	2	汽車駕駛人行至有號誌之交岔路口，遇交通擁擠而逕行駛入交岔路口範圍內，致妨礙其他車輛 通行者，以下何者正確？	(1)	視同闖紅燈處新臺幣1,800元至5,400元罰鍰，並記駕駛人違規點數3點。	(2)	處罰鍰新臺幣600元至1,200元。	(3)	情形特殊，不能歸責汽車駕駛人，故不 予處罰。	
498	2	汽車於紅燈時，跨越停止線在路口內進行迴轉，其行為應如何認定？	(1)	屬「違規迴轉」，須處以罰鍰。	(2)	屬「闖紅燈」，因其在紅燈時跨越停止線進入路口範圍。	(3)	只要迴轉後未超 越路口對端，即不具違規事實。	
499	1	在設有號誌路口，紅燈亮起時，直接右轉，係屬何種違規行為？	(1)	屬闖紅燈行為。	(2)	不屬闖紅燈行為，屬紅燈右轉行為。	(3)	只要沒肇事就不屬闖紅燈行為。	
500	1	車輛於未繪設路口範圍，無視於紅燈號誌，而有穿越路口之企圖，其車身並已伸越停止線且足以妨害其他方向人車通行者，是否為闖紅燈之行為？	(1)	是。	(2)	否。	(3)	無特別規定。	
501	1	救護車非執行緊急救護勤務未鳴警號時，行經有號誌管制之交岔路口闖紅燈，是否為闖紅燈之行為？	(1)	是。	(2)	否。	(3)	無特別規定。	
502	2	下列哪一種情況會被認定為「闖紅燈」？	(1)	紅燈亮起前已完全駛入路口且安全通過。	(2)	紅燈亮起時，前輪逾停止線後，停放於行人穿越道。	(3)	紅燈亮起時車輛仍停在停止線前。	
503	2	關於汽車於紅燈亮起後，車身跨壓行人穿越道之法律效果，下列敘述何者正確？	(1)	依「紅燈越線」，處分。	(2)	依「闖紅燈」處分。	(3)	若不至於妨礙行人通行，只勸導，不處以罰鍰。	
504	2	汽車駕駛人行駛至交岔路口轉彎時應：	(1)	多車道路口可以由外側車道直接左轉。	(2)	左轉彎時，距交岔路口30公尺前顯示方向燈，換入內車道或左轉車道。	(3)	多車道路口內側車道車 輛，可以直接右轉。	
505	1	在紅燈停等時，若橫向號誌已變紅燈，但自身方向綠燈尚未亮起，即先行起步跨越行人穿越 道，進行迴轉，下列敘述何者正確？	(1)	屬「闖紅燈」。	(2)	在我方綠燈亮起前，搶先一步起步迴轉，反正又不妨礙其他人車通行，屬「正常起步」。	(3)	認定「不遵守道路交通標誌、標線、 號誌之指示」行駛，處以罰鍰。	
506	3	車道設有「左轉彎專用道」，當僅直行及右轉綠箭頭亮起時，汽車駕駛人逕行透過左轉彎專用 道左轉之法律後果為何？	(1)	視同「闖紅燈」，因該方向箭頭未亮即禁止通行。	(2)	視為「合法轉彎」，但須負絕對路權之注意義務。	(3)	視為「轉彎時，不依標誌、標線、號誌指示」， 處罰鍰。	
507	1	當汽車行近行人穿越道，行人穿越道上已有行人通行，汽車應與行人保持多少距離才不違規？	(1)	應至少保持 3 公尺之距離。	(2)	應保持 1 公尺之安全避讓距離。	(3)	只要車輛不與行人 發生碰撞，並無特定距離限制。	
508	3	汽車行經未劃設行人穿越道之交岔路口，遇有行人穿越時，應如何處理？	(1)	按鳴喇叭示意行人快速通過。	(2)	減速慢行，並視情況保持距離通過。	(3)	無論有無交通指揮人員指揮或號誌指 示，均應暫停讓行人優先通過。	
509	1	關於「閃光紅燈」與「閃光黃燈」之區別，下列敘述何者正確？	(1)	閃光紅燈表示車輛應「停車再開」；閃光黃燈表示車輛應「減速接近，注意安全，小心通過」。	(2)	兩者皆只需放慢油門 即可通過。	(3)	閃光黃燈必須完全停止後再開；閃光紅燈則只需減速。	
510	2	車輛行至無號誌之圓環路口時，關於通行優先順序，下列敘述何者正確？	(1)	應依「左方車讓右方車先行」原則，右側欲進入圓環之車輛優先。	(2)	應讓已在圓環內行駛之車輛先行，再依序 駛入。	(3)	由較寬或車流量較大道路駛來之車輛，優先進入圓環。	
511	2	駕駛汽車進入「行人優先區」，此時前方有行人在路中行走且未注意到後方來車，防禦作為為何？	(1)	輕點喇叭提醒行人，待其靠邊後加速通過。	(2)	在行人後方保持安全距離，減速慢行並 暫停等待，不得按鳴喇叭促其讓路。	(3)	從行人側邊狹窄空間快速駛過以淨空道路。	
512	3	汽車駕駛人行至有燈光號誌管制之大眾捷運系統車輛共用通行交岔路口，紅燈右轉者，處罰鍰 新臺幣多少 ？	(1)	600~1,800元。	(2)	900~2,700元。	(3)	1,200~3,600元。	
513	1	關於道路上設置之「通學區起點」標誌，其主要之法規功能定義為何？	(1)	告示該路段為學生上下學主要路徑，提醒駕駛人應減速慢行。	(2)	告示該路段禁止任何車輛進入，僅供校車及教職 員車輛通行。	(3)	告示該路段為私人土地，僅限該校師生於特定時段進出使用。	
514	1	在設有「左轉箭頭」及「圓形」綠燈的交岔路口，若此時亮起「圓形綠燈」，下列敘述何者正確？	(1)	圓形綠燈具備全向通行功能，車輛在禮讓對向直行車後可以左轉。	(2)	必須等待左轉箭 頭綠燈亮起後，才可以左轉。	(3)	圓形綠燈亮起時，任何情況下均禁止左轉。	
515	2	駕駛人行經山區道路，見前方設有「危險」警告標誌，但未附設說明牌，此時應如何處置？	(1)	該標誌僅為一般提醒，維持原速通過即可。	(2)	提高警覺、減速慢行，注意前方各種可能之危險 狀況。	(3)	該路段必定有落石，應立即停車觀察後再通行。	
516	3	汽車行至無號誌路口，未劃分幹、支線道且車道數相同時，下列敘述何者錯誤？	(1)	轉彎車應暫停讓直行車先行。	(2)	同為直行車或轉彎車者，左方車應暫停讓右方車先行。	(3)	優先進入路 口之車輛先行。	
517	2	三角形「注意號誌」警告標誌，最可能設置於下列何種路段？	(1)	設有行車管制號誌之路口處，用以加強號誌辨識度。	(2)	號誌不易察覺之路口前方適當距離，預先提醒駕駛人。	(3)	未設置號 誌之路口，用以替代行車管制號誌管制交通。	
518	1	IMAGEIMAGEIMAGEp039_img01_xref250__DOT__png 圖中交通指揮手勢為:	(1)	全部車輛停止。	(2)	前面來車停止。	(3)	左方來車停 止。	
519	1	IMAGEIMAGEIMAGEp039_img02_xref252__DOT__png 交通指揮人員可藉由手勢的指揮來引導行進車輛，此指揮手勢代表的意義為？	(1)	左面來車左轉彎。	(2)	右面來車左轉彎。	(3)	右面來車速行。	
520	2	駕駛人行經路口，交通指揮人員以手勢示意其左轉彎，此時駕駛人應如何行駛？	(1)	依手勢指示 立即左轉，指揮人員已確保路口淨空，無須再注意其他人車。	(2)	依手勢指示左轉，但轉彎時仍應減速慢行，注意對向直行車及路口行人。	(3)	先自行觀察確認安全後再決定是否左轉，指揮手 勢僅為建議。	
521	2	行車管制號誌由紅燈轉為綠燈之前，會先顯示黃燈。關於黃燈之意義，下列何者正確？	(1)	黃燈 表示「注意」，車輛應減速慢行，可繼續通過路口。	(2)	黃燈表示「警告車輛駕駛人及行人，表示紅色燈號即將顯示，屆時將失去通行路權。」，已過停止線者應迅速通過，未過者應停等。	(3)	黃燈為紅綠燈轉換之過場燈號，無法律上管制效力。	
522	2	IMAGEIMAGEIMAGEp039_img03_xref253__DOT__png 交通指揮人員可藉由手勢的指揮來引導行進車輛，圖中交通指揮人員手勢表示？	(1)	右面來車速行。	(2)	左面來車速行。	(3)	全部車輛停止。	
523	3	以下何者圖示為『狹路』？	(1)	IMAGEIMAGEIMAGEp039_img04_xref254__DOT__png	(2)	IMAGEIMAGEIMAGEp039_img05_xref255__DOT__png	(3)	IMAGEIMAGEIMAGEp039_img06_xref256__DOT__png	
524	2	關於行人穿越道標線，「枕木紋」與「斑馬紋」之設置原則，下列何者正確？	(1)	枕木紋設於無號誌路段，斑馬紋設於有號誌路口。	(2)	枕木紋設於有或無號誌的交岔路口，斑馬紋設於有 號誌，道路中段，行人穿越眾多之地點。	(3)	兩者用途相同，僅為外觀不同，可互相替換設 置。	
525	2	駕駛人行經路口時，發現交通指揮人員之手勢與行車管制號誌指示不一致，應如何遵行？	(1)	以行車管制號誌為準，因號誌具有法律效力，手勢僅供參考。	(2)	以交通指揮人員之手勢為準，指 揮手勢優先於號誌指示。	(3)	駕駛人得自行判斷路口狀況，擇一遵行即可。	
526	1	IMAGEIMAGEIMAGEp040_img01_xref259__DOT__png 圖中手勢代表何種意義？	(1)	左方來車停止。	(2)	右方來車停止。	(3)	前方來車停止。	
527	2	行至圓環時，下列何者正確？	(1)	可以在圓環臨時停車。	(2)	行至無號誌之圓環路口時，應讓已進入圓環車道之車輛先行。	(3)	圓環標誌，為禁制標誌，用以促使車輛駕駛人注意慢行，讓外環 車輛優先通行。	
528	1	IMAGEIMAGEIMAGEp040_img02_xref260__DOT__png 以下標誌意義為何？	(1)	行人優先區起點標誌。	(2)	行人危險標誌。	(3)	行人禁 止進入標誌。	
529	1	IMAGEIMAGEIMAGEp040_img03_xref261__DOT__png 以上標誌意義為何？	(1)	指示前端道路無出口不能通行，設於不通道路之入口處。	(2)	前方道路施工中。	(3)	單行道。	
530	1	關於「停止線」，下列敘述何者錯誤？	(1)	引導車輛駕駛人循指示之路線行駛。	(2)	本標線為白實線。	(3)	用以指示車輛停止之界線。	
531	1	IMAGEIMAGEIMAGEp040_img04_xref262__DOT__png 地上白色倒三角型標線為？	(1)	讓路線。	(2)	單行道。	(3)	禁止停車。	
532	1	IMAGEIMAGEIMAGEp040_img05_xref263__DOT__png 請問此手勢為何？	(1)	右方來車速行。	(2)	左方來車速行。	(3)	右方來車左轉彎。	
533	2	駕駛人行經路口見路面繪有白色倒三角形「讓路線」標線，下列何種駕駛行為符合規定？	(1)	須在標線前完全停車，確認安全後方可再行駛。	(2)	應減速慢行，注意幹道來車動態，禮讓幹道車 輛優先通行。	(3)	標線僅提醒前方有路口，駕駛人可維持原速通過。	
534	3	IMAGEIMAGEIMAGEp040_img06_xref264__DOT__png	(1)	禁止停車。	(2)	禁止臨時停車。	(3)	停車再開。	
535	2	駕駛人行經山區道路，見前方設有「左側斷崖」警告標誌時，應如何因應？	(1)	將車輛駛向道路左側，以便觀察崖邊狀況提早應變。	(2)	減速慢行，靠道路右側行駛，遠離斷崖側並注意路況變 化。	(3)	加速通過該路段，縮短車輛暴露於危險區域之時間。	
536	1	IMAGEIMAGEIMAGEp040_img07_xref265__DOT__png 這個警察指揮手勢表示？	(1)	前方來車停止。	(2)	前後停止左右通行。	(3)	全部	
537	2	車輛停止。汽車駕駛人行至輕軌捷運系統路口時？	(1)	應減速慢行，確認安全後通過，必要時可停留於軌 道區。	(2)	應注意列車動態，於確保安全下迅速通過，不得停留於軌道區。	(3)	若前方車輛壅 塞，仍可駛入軌道區等待通行。	
538	2	關於「車道管制號誌」，下列敘述何者正確？	(1)	以紅、黃、綠圓形燈號管制車輛在路口之行 止，設於交叉路口。	(2)	以「✕」形紅燈，「⬇️」形綠燈或「↙️」「↘️」形黃燈，管制個別車道之使用，常用於調撥車道路段。	(3)	以紅、綠色人形燈號指示行人可否通行，設於行人穿越 道端點。	
539	2	駕駛人行經無號誌路段之「斑馬紋行人穿越道」時，遇有行人正在穿越，應如何處置？	(1)	減速並鳴按喇叭示警，提醒行人加速通過。	(2)	暫停讓行人優先通過，不得強行搶道。	(3)	行人應注 意來車自行避讓，駕駛人可維持車速通過。	
540	2	駕駛人行駛中見到「注意號誌」警告標誌時，應如何因應？	(1)	表示前方號誌即將轉為紅燈，應立即減速準備停車。	(2)	表示前方設有行車管制號誌，應提前注意並準備依號誌指示行駛。	(3)	表示前方號誌僅供參考，駕駛人可自行判斷是否通行。	
