qid	answer	tigan	o1	p1	o2	p2	o3	p3	tail
1	2	IMAGEIMAGEIMAGEp001_img01_xref14__DOT__png	(1)	禁止任何車輛進入。	(2)	禁止四輪以上汽車及機車進入。	(3)	禁止行人通行。	
2	1	IMAGEIMAGEIMAGEp001_img02_xref16__DOT__png	(1)	禁止超車。	(2)	禁止會車。	(3)	禁止汽車進入。	
3	2	IMAGEIMAGEIMAGEp001_img03_xref18__DOT__png	(1)	雙向道。	(2)	禁止會車。	(3)	分道。	
4	3	當開車進入「國道施工路段」時，下列哪一項駕駛行為最能有效預防事故發生？	(1)	在施工縮減車道處加速超車。	(2)	開啟駕駛輔助系統後便放心地看手機。	(3)	提早變換至未施工車道，並保持隨時準備煞車的安全距離與專注力。	
5	1	駕駛配備有 Level 2 等級先進駕駛輔助系統 (ADAS) 的新車行駛於國道。關於在駕駛過程中 的行為與認知，下列哪一項最符合安全規範並能有效預防事故？	(1)	認知到目前的系統對「靜止工程車」辨識有限制，行經施工路段時應主動介入駕駛，而非依賴系統。	(2)	系統會 自動跟車與修正方向盤，可以趁機滑手機或閉目養神。	(3)	因為系統能辨識車道線，所以行 駛於大雨或大霧路段時，交給電腦操作比人工駕駛更安全。	
6	2	下列關於「變換車道」的行為，何者錯誤？	(1)	變換車道時，應讓直行車先行，並注意安全距離。	(2)	在雙白實線上可雙邊變換車道。	(3)	顯示方向燈、轉頭察看照後鏡、檢查視野死角並注意有無障礙或車輛行人。	
7	3	駕駛人行駛至交岔路口，其行進、轉彎時，下列規定何者正確？	(1)	由慢車道右轉彎時應於距交岔路口20至40公尺處，換入慢車道。	(2)	右轉彎時，應距交岔路口50公尺前顯示方 向燈。	(3)	於外側車道右轉彎時，應距交岔路口30公尺前顯示方向燈。	
8	1	汽車行駛中變換車道時，若未依規定全程顯示方向燈，其規定為何？	(1)	不論一般道路或高速公路，均屬違規行為，應依法裁罰。	(2)	行駛於高速公路時，才屬違規行為。	(3)	只要 確認後方無來車，未顯示方向燈亦不具罰責。	
9	1	汽車在同向二車道以上之道路，除應依標誌或標線之指示行駛外，下列何種行為正確？	(1)	變換車道時，應讓直行車先行並注意安全距離。	(2)	小型汽車行駛速度較慢時，應在外側車 道行駛，但可任意變換車道。	(3)	執行任務中之救護車，應行駛內側車道。	
10	3	汽車駕駛人於車流中利用空隙頻繁變換車道超車，下列何者正確？	(1)	屬合理駕駛行為。	(2)	未影響他人可接受。	(3)	不得任意以迫近，驟然變換車道或其他不當方式，迫使他車讓道。	
11	2	汽車駕駛人行駛於高速公路、快速公路，以變換燈光、連續密集按鳴喇叭迫使前車讓道，下列何者正確？	(1)	提醒前車讓路並無違規。	(2)	處新臺幣3,000元以上；6,000元以下罰鍰。	(3)	只要未發生事故不處罰。	
12	3	關於車輛配置之「先進駕駛輔助系統(ADAS)，如自動車距保持系統(ACC)、車道維持輔助系統 (LKA)」，下列敘述何者正確？	(1)	開啟系統後，駕駛人可以滑手機或短暫閉眼休息。	(2)	系統能辨識前方靜止障礙物（如工程車），不必擔心追撞。	(3)	屬輔助功能，駕駛人應隨時 注意前方路況，並雙手握持方向盤主動監控。	
13	2	汽車駕駛人在道路上任意以迫近、驟然變換車道方式迫使他車讓道：	(1)	有顯示方向燈即為正當行為。	(2)	屬於不當駕駛行為。	(3)	只要不發生事故即可。	
14	2	汽車駕駛人行經路口，遇有交通警察指揮與燈號顯示不一致時，應如何行駛？	(1)	以燈號顯示為準。	(2)	聽從交通警察指揮行駛。	(3)	視當時交通狀況，跟隨前車行駛。	
15	3	曾因酒駕經吊銷駕駛執照，於重新考照後，必須加裝何種設備於車上始得行駛？	(1)	行車紀錄器。	(2)	車用滅火器。	(3)	車輛點火自動鎖定裝置(酒精鎖)。	
16	2	完成酒駕防制教育或酒癮治療並經考驗合格後，拿到的駕照僅能開裝設有車輛點火自動鎖定裝置(酒精鎖)之汽車且強制使用時間為？	(1)	半年。	(2)	1年。	(3)	3年。	
17	3	關於酒駕之規定，下列何者正確？	(1)	酒測值標準是吐氣所含酒精濃度達每公升0.25毫克或血液中酒精濃度達0.10%以上。	(2)	12年內再犯酒駕，處新臺幣120,000元罰鍰。	(3)	酒駕 拒測處新臺幣180,000元罰鍰，並當場移置保管該汽機車、吊銷其駕駛執照。	
18	1	汽車駕駛人，駕駛汽車經測試檢定吐氣所含酒精濃度達每公升0.25毫克或血液中酒精濃度達 0.05%以上，18歲以上未滿70歲之同車乘客，倘無特殊原因，是否應受處罰，下列敘述何者正確？	(1)	同車乘客應受處罰。	(2)	同車乘客無處罰機制。	(3)	同車乘客只要無飲酒即無須受 處罰。	
19	3	汽車駕駛人飲酒後已間隔一段時間，自認酒精已代謝且無不適，下列何者正確？	(1)	可依自身感覺駕駛。	(2)	只要身體未出現不適，即可駕駛。	(3)	喝酒後不得駕車。	
20	2	汽車駕駛人酒後駕車初犯，酒精濃度測試超過法規標準，下列何者正確？	(1)	處新臺幣1萬5千至9萬元罰鍰。	(2)	處新臺幣3萬元至12萬元罰鍰，並吊扣駕照。	(3)	僅警告。	
21	2	汽車駕駛人10年內第3次以上酒駕，下列何者正確？	(1)	僅增加罰鍰。	(2)	按前次處罰鍰金額加罰新臺幣9萬元並吊銷駕照，公布其姓名。	(3)	僅記違規點數。	
22	3	根據現行規定，若駕駛人遭遇警察攔檢並明確表示「拒絕接受酒精濃度測試」，其初次違規 的處罰為何？	(1)	視酒精濃度決定罰鍰金額高低，當場移置保管該汽機車及吊扣其駕駛執照，接受道路交通安全講習。	(2)	處新臺幣 9 萬元罰鍰，當場移置保管該汽機車及吊銷其駕 駛執照，接受道路交通安全講習。	(3)	處新臺幣 18 萬元罰鍰，當場移置保管該汽機車及吊 銷其駕駛執照，接受道路交通安全講習。	
23	2	關於酒駕「累犯」的加重處罰規定，若駕駛人在幾年內第二次違反酒駕規定，將會被視為累犯並處以最高額罰鍰，且其後每次違規都會按次加罰 9 萬元？	(1)	5年內。	(2)	10年內。	(3)	終身計算，無期限限制。	
24	3	推廣「代駕服務」是減少酒駕的重要手段。關於代駕服務的觀念，下列哪一項敘述最能正確 體現安全保障？	(1)	若叫不到代駕，可以先休息一下再慢慢開車回家。	(2)	代駕只需負責把車開走，乘客不需在意代駕是否有專業執照。	(3)	代駕服務雖然需付費，但比起酒駕產生的 罰鍰、刑事責任與人命損失，是成本最低的選擇。	
25	2	汽車駕駛人有酒駕毒駕之情形，除汽車駕駛人處罰鍰及吊扣(銷)駕照處分外，所駕駛之該車 輛尚須？	(1)	該車汽車所有人如非駕駛人，須接受口頭警告並參加講習。	(2)	吊扣該汽機車牌照二年，並於移置保管該汽機車時，扣繳其牌照。	(3)	吊銷該汽機車牌照六個月，並於 移置保管該汽機車時，扣繳其牌照。	
26	2	關於汽機車駕駛人「酒測值超標」時，針對「同車乘客」之連坐處分，下列何種情況「免予處罰」？	(1)	乘客聲稱並不知道駕駛人有飲酒者。	(2)	乘客為未滿18歲、或年滿70歲 者。	(3)	乘客與駕駛人並無親屬關係者。	
27	3	駕駛人酒精濃度超過規定標準，駕車肇事致人重傷或死亡者，除依刑法處置外，其行政處分為何？	(1)	吊扣駕駛執照2年，並參加道路交通安全講習。	(2)	吊銷駕駛執照，並3年內不得 考領。	(3)	吊銷駕駛執照，並終身不得再考領。	
28	1	汽車駕駛人酒精濃度超過規定標準，且同車附載未滿12歲兒童，依規定其處罰為何？	(1)	處 新臺幣3萬元以上至12萬元以下罰鍰，並吊扣其駕駛執照2年至4年。	(2)	處新臺幣3萬元以上至12萬元以下罰鍰，並吊扣其駕駛執照1年至2年。	(3)	處最高新臺幣12萬元罰鍰 並吊銷駕駛執照。	
29	1	若駕駛人拒絕接受酒精濃度測試檢定，依現行法規應處以：	(1)	新臺幣18萬元罰鍰，且當場移置保管該車及吊銷駕照。	(2)	新臺幣6萬元罰鍰及吊扣汽車牌照6個月。	(3)	新臺幣9萬 元罰鍰，並記違規點數3點。	
30	3	酒駕防制教育訓練課程內容含括道路交通法令、肇事預防處理及法律責任等，總時數共：	(1)	10小時。	(2)	12小時。	(3)	15小時。	
31	1	汽車駕駛人申請參加酒駕防制教育訓練之費用由誰負擔？	(1)	汽車駕駛人。	(2)	衛生福利部。	(3)	訓練辦理機關。	
32	1	駕駛他人車輛酒駕違規是否須受吊扣牌照處分？	(1)	仍須吊扣牌照。	(2)	只要不是自己的車就不用吊扣。	(3)	無特別規定。	
33	2	汽車駕駛人於幾年內第2次違反「酒精濃度超過規定標準」規定，依其駕駛車輛所定罰鍰最高額處罰之？	(1)	5年。	(2)	10年。	(3)	15年。	
34	3	汽車所有人明知汽車駕駛人有酒精濃度超過規定標準、吸食毒品、迷幻藥等情形，而不予禁止駕駛者，依道路交通管理處罰條例之規定，除處罰鍰外，將對該汽車採取何種處分？	(1)	吊 扣該汽車牌照6個月	(2)	吊扣該汽車牌照1年	(3)	吊扣該汽車牌照2年	
35	3	汽車駕駛人酒後駕車經抽血檢測，血液中酒精濃度超過0.05%，依照道路交通管理處罰條例下列何者為錯誤？	(1)	同車年滿18歲乘客應受罰鍰。	(2)	同車年逾70歲或公車乘客不必受 罰。	(3)	只有汽車駕駛人受罰。	
36	2	裝設車輛點火自動鎖定裝置(酒精鎖)之車輛，駕駛人啟動前須符合何種條件？	(1)	插入鑰匙即可啟動。	(2)	吐氣酒精濃度檢測為0。	(3)	經車主同意。	
37	2	汽車駕駛人行車時，遇前方道路壅塞情況下應？	(1)	緊貼前車，避免後車超車。	(2)	與前車維持適當安全距離，依序前進。	(3)	於車流間蛇行穿梭。	
38	2	汽車駕駛人在道路上蛇行，或以其他危險方式駕車（如惡意逼車），下列處罰何者正確？	(1)	處以罰鍰，並不禁止其駕駛。	(2)	處以罰鍰，因而肇事者，並吊銷其駕駛執照，當場禁止 駕駛。	(3)	處以罰鍰，並吊銷其駕駛執照。	
39	2	汽車駕駛人行經路口，遇有警察指揮與燈號顯示不一致時，應如何行駛？	(1)	以燈號顯示為準。	(2)	聽從警察指揮行駛。	(3)	視當時交通狀況，跟隨前車行駛。	
40	2	汽車駕駛人於行駛道路時，手持香菸、吸食、點燃，有影響他人安全者，下列何者正確？	(1)	個人嗜好不處罰。	(2)	違反道路交通管理處罰條例處新臺幣1,200元罰鍰。	(3)	屬於違反環 保法規問題。	
41	2	關於汽車裝載貨物之規定，下列何者屬於「不當行為」且會受罰？	(1)	裝載貨物綑紮牢固，堆置穩妥。	(2)	裝載貨物超過規定的長度、寬度、高度，或未覆蓋嚴密致散落物掉落路面。	(3)	裝載物品重量未超過核定總重量。	
42	3	汽車駕駛人拒絕接受酒精濃度測試檢定者，應處罰鍰新臺幣多少？	(1)	6萬元。	(2)	9萬元。	(3)	18萬元。	
43	2	關於路側劃設之「紅色實線」（禁止臨時停車線），其禁止臨時停車之時間原則為何？	(1)	僅限於每日上午7時至晚間8時。	(2)	除另有規定外，原則上為全天24小時。	(3)	僅限於夜間 時段以維護交通安全。	
44	3	駕駛人酒精濃度超過規定標準，駕車肇事致人重傷或死亡者，其處分為何？	(1)	吊銷駕駛執照，1年內不得考領。	(2)	吊銷駕駛執照，2年內不得考領。	(3)	吊銷駕駛執照，終身不得再考 領。	
45	3	汽車行駛下長坡時，正確的駕駛方式為何？	(1)	儘量使用腳煞車控制速度。	(2)	完全不使用任何煞車，讓車輛自然滑行。	(3)	善用低速檔引擎煞車，避免過度使用腳煞車。	
46	2	下列哪一項敘述是錯誤的？	(1)	設有禁止停車之標誌路段，可以臨時停車。	(2)	設有禁止停車之標誌路段，不可以臨時停車。	(3)	設有禁止停車之標線路段，如無其他標誌、標線規定，夜 間8時以後至隔日清晨7時以前可以停車、臨時停車。	
47	3	汽車駕駛人於10年內第2次違反酒駕規定，其罰鍰金額為新臺幣？	(1)	6萬元。	(2)	9萬元。	(3)	12萬元。	
48	2	汽車駕駛人連續駕車超過8小時，如應歸責於汽車所有人者，應受到何種處分？	(1)	吊銷汽車牌照。	(2)	吊扣汽車牌照3個月。	(3)	罰鍰3萬元。	
49	2	在設有禁止停車標誌、標線(黃實線)的路段，停車規定為何？	(1)	禁止臨時停車。	(2)	可以臨時停車。	(3)	可以停車。	
50	1	小型車在設有彎道、狹路、坡路、單行道標誌之路段，因讓車、停車或起駛有必要者，是否可以倒車？	(1)	可以。	(2)	不可以。	(3)	須有人在車後指引才可以。	
51	1	汽車駕駛人將駕照借供他人駕車者，應處罰：	(1)	吊扣其駕照。	(2)	吊銷其駕照。	(3)	吊扣其車輛牌照。	
52	3	汽車駕駛人在1年內違規記點每達12點者，除施以道安講習，並處：	(1)	吊銷駕照。	(2)	罰鍰。	(3)	吊扣駕照。	
53	3	汽車駕駛人酒精濃度超過規定標準者，處新臺幣多少元罰鍰？	(1)	1,200元~2,400元。	(2)	6,000元~1萬2,000元。	(3)	3萬元~12萬元。	
54	2	在設有彎道、坡路、狹路、狹橋、隧道標誌之路段或鐵路平交道可否迴車？	(1)	可以。	(2)	不可以。	(3)	無特別規定。	
55	3	職業汽車駕駛人之職業駕駛執照因逾期審驗被註銷時，關於其申請與駕駛規定，下列何者正 確？	(1)	得憑該已註銷之職業駕駛執照申請換發同等車類之普通駕駛執照，且在未換發前仍可駕駛汽車。	(2)	不得申請換發普通駕駛執照，須重新考照後方可駕駛。	(3)	得申請換發同等 車類之普通駕駛執照，但在未換發前不得駕駛汽車。	
56	2	汽車駕駛人行駛道路下列何者為對？	(1)	遇有急事要聯絡，可以使用行動電話。	(2)	以手持方式使用行動電話、電腦或其他相類功能裝置進行撥接、通話、數據通訊或其他有礙駕駛安全 之行為，均為禁止之行為。	(3)	只要不妨礙他人安寧都可以使用撥接通話 	
57	3	關於汽車載人規定，下列何者正確？	(1)	車廂外可視情況載人。	(2)	只要車速低即可於車外載人。	(3)	汽車車廂以外不得載人。	
58	1	小型汽車在同向二車道以上道路行駛時，下列何者敘述正確？	(1)	內外側車道均可行駛。	(2)	行駛速度較慢時，應靠內側車道行駛。	(3)	可任意變換車道。	
59	2	IMAGEIMAGEIMAGEp005_img01_xref27__DOT__png 此標誌所代表之意義？	(1)	禁止汽車進入。	(2)	禁止空計程車進入。	(3)	禁止任何車輛進入。	
60	1	IMAGEIMAGEIMAGEp005_img02_xref29__DOT__png 此標誌所代表之意義？	(1)	禁止任何車輛進入。	(2)	單行道。	(3)	減速慢行。	
61	2	汽車行駛時，駕駛人對於視線範圍內顯示設備之使用，下列何者正確？	(1)	行車時可使用車內影音設備，只要關閉聲音即可。	(2)	娛樂性顯示設備應關閉，但導航或倒車影像等行車輔助 顯示可使用。	(3)	所有顯示設備均不得開啟，以免影響駕駛注意力。	
62	2	汽車駕駛人吸食毒品、迷幻藥、麻醉藥品或酒類後駕駛汽車，下列何者錯誤？	(1)	若因而肇事致人死亡者，處罰鍰並當場移置保管車輛、吊銷駕駛執照，終身不得再考領。	(2)	僅處罰 鍰。	(3)	處罰鍰並當場移置保管車輛、吊扣駕照。	
63	1	駕駛人將車輛駛入加油站準備加油，下列做法何者正確？	(1)	熄火並關閉電氣設備，加油全程不使用行動電話，加油完畢後再啟動引擎駛離。	(2)	加油時間短暫，可維持引擎怠速運轉並開啟空調，待加油完畢再出發。	(3)	加油過程中為節省時間，可在車內使用打火機點菸或檢查行李廂內物品。	
64	2	駕駛人行車中發現後座孩童將手伸出車窗外，下列做法何者正確？	(1)	車速不快且路旁無來車時，短暫伸出並無大礙，提醒孩童注意即可。	(2)	行駛中乘客不得將頭手伸出車外，駕駛人應立即制止並關閉車窗或開啟車窗安全鎖。	(3)	乘客自身行為由乘客負責，駕駛人專心駕駛不宜分心處理。	
65	2	汽車行駛於道路時，駕駛人：	(1)	可以手持方式使用行動電話、電腦或其他相類功能裝置進行撥接、通話、數據通訊或其他有礙駕駛安全之行為。	(2)	不可以手持方式使用行動電話、電腦 或其他相類功能裝置進行撥接、通話、數據通訊或其他有礙駕駛安全之行為。	(3)	路況良好 時可以手持方式使用行動電話、電腦或其他相類功能裝置進行撥接、通話、數據通訊或其他 有礙駕駛安全之行為。	
66	3	在行車途中，精神疲勞稍有睡意，你應該怎麼辦：	(1)	提起精神，並減速慢行。	(2)	擦抹或服食藥物助長精神，照常行駛。	(3)	在最近適當路邊停車，下車稍作休息，恢復精神再開車。	
67	2	行駛市區道路時，後方有消防車鳴笛駛近，而駕駛人恰好與消防車同方向同路線，下列做法何者正確？	(1)	跟隨消防車行駛可通過壅塞路段，只要保持安全距離即可。	(2)	應靠右讓路待消防車通過後，依正常速限行駛，不得尾隨急駛。	(3)	消防車通過後路面已無障礙，應加速跟上以儘快通過該路段避免回堵。	
68	1	駕駛人赴宴飲酒後，自覺僅喝了一點且頭腦清醒，同行友人亦表示看不出異狀，下列觀念何 者正確？	(1)	飲酒後即使自覺清醒，酒精仍會影響反應與判斷能力，應改搭計程車或代駕。	(2)	經同行友人觀察確認並無異狀，且自覺意識清楚，可自行駕車返家。	(3)	先在車內休息30分鐘待酒精消退後，即可安全駕車上路。	
69	2	依道路交通安全規則規定，下列何者不得參加汽車駕駛執照考驗？	(1)	已戒除酒癮並取得醫師證明、體檢合格者。	(2)	酒精、麻醉藥品、鴉片類或其代用品成癮者。	(3)	曾因酒後駕車被吊銷駕照，禁考期間已屆滿者。	
70	2	汽機車駕駛人酒後駕車，其吐氣酒精濃度超過規定標準但未涉刑事處罰者，應處：	(1)	移送法院依刑法判刑。	(2)	罰鍰並當場移置保管該汽車及吊扣其駕駛執照1至2年、吊扣牌照2 年。	(3)	吊銷駕駛執照。	
71	3	汽車駕駛人，行車速度超過規定之最高時速40公里以上者，處罰鍰新臺幣：	(1)	1,200～2,400元。	(2)	2,400～6,000元。	(3)	6,000～ 36,000元。	
72	1	酒醉駕車或行經行人穿越道不讓行人優先通行因而致人傷亡，如應負刑責者：	(1)	加重其刑至二分之一。	(2)	不須處罰。	(3)	仍按原來刑度處罰。	
73	1	汽車駕駛人於行駛道路時，以手持方式使用行動電話、電腦或其他相類功能裝置進行撥接、通話、數據通訊或其他有礙駕駛安全之行為者，處罰鍰新臺幣：	(1)	3,000元。	(2)	2,000元。	(3)	1,000元。	
74	1	駕車酒精濃度超過規定標準，除當場移置保管該汽機車及吊扣其駕駛 執照1至2年，並處罰 鍰新臺幣：	(1)	機車15,000 ~90,000元、汽車30,000~120,000元。	(2)	機車10,000~90,000元、汽車 30,000 元~90,000元。	(3)	機車6,000 ~ 12,000元、汽車 30,000 元~90,000 元。	
75	2	酒精濃度超過規定標準駕車之違規人，於10年內第2次違反酒後駕車之規定，除處罰鍰新臺幣120,000元，及當場移置保管該汽車，並應施以道路交通安全講習：	(1)	吊扣其牌照。	(2)	吊銷其駕駛執照。	(3)	吊扣其駕駛執照。	
76	3	兩輛以上之汽車在道路上競駛或競技者，除處罰汽車駕駛人新台幣 30,000~90,000元罰鍰，及當場禁止其駕駛，並應：	(1)	吊扣其駕駛執照。	(2)	吊銷其牌照。	(3)	吊銷其駕駛執照，並吊 扣汽車牌照6個月。	
77	1	汽車駕駛人若拒絕接受酒精濃度測試檢定者，除處罰鍰新臺幣 180,000元，並應施以道路交通安全講習：	(1)	吊銷其駕駛執照。	(2)	吊扣其駕駛執照。	(3)	吊扣其牌照。	
78	3	汽車所有人，明知駕駛人有酒後駕車之情形，而不予禁止者，除處罰鍰外，並應：	(1)	吊銷該汽車牌照。	(2)	吊扣其駕照。	(3)	吊扣該汽車牌照。	
79	2	汽車駕駛人無照駕駛或酒醉駕車因而致人受傷或死亡，依法應負刑事責任者，加重其刑至：	(1)	三分之一。	(2)	二分之一。	(3)	一倍。	
80	3	汽機車駕駛人，駕駛汽機車經酒精濃度測試檢定超過標準值，除罰鍰、 當場移置保管該汽機車外，並吊扣其駕駛執照：	(1)	3個月。	(2)	6個月。	(3)	1至2年。	
81	3	汽車駕駛人於道路上蛇行駕駛，應處以：	(1)	罰鍰。	(2)	講習。	(3)	罰鍰及吊扣牌照6個月並應接受道路交通安全講習。	
82	2	酒後駕車酒精濃度超過規定標準被當場移置保管車輛，其罰鍰：	(1)	可以易處吊扣駕照。	(2)	不可以易處吊扣駕照。	(3)	沒規定。	
83	1	在高速或快速公路行車：	(1)	不得超速競駛，不得低速併行。	(2)	可以超速競駛，但不得低速併行。	(3)	不得超速競駛，卻可以低速併行。	
84	3	酒後開車，對駕駛人會產生「視覺之隧道效應」，駕駛者猶如在隧道中行車，前有亮光但四周漆黑，故酒後駕車：	(1)	視野不變。	(2)	視野變廣。	(3)	視野變窄。	
85	1	汽車駕駛人駕駛汽車經測試檢定，其吐氣所含酒精濃度不得達每公升：	(1)	0.15毫克。	(2)	0.25毫克。	(3)	0.55毫克。	
86	3	小客車附載幼童未依規定安置於安全椅者，應處駕駛人：	(1)	吊扣駕駛執照。	(2)	吊銷駕駛執照。	(3)	罰鍰。	
87	2	汽車駕駛人對於6歲以下或需要特別看護之兒童，單獨留置車內者，處駕駛人：	(1)	罰鍰。	(2)	罰鍰並施以4小時道路交通安全講習。	(3)	罰鍰並予違規記點。	
88	3	汽車駕駛人對幾歲以下或需要特別看護之兒童，單獨留置於車內者，處駕駛人新臺幣3,000元罰鍰，並施以4小時道路交通安全講習：	(1)	4歲。	(2)	5歲。	(3)	6歲。	
89	1	汽車駕駛人行車速度，超過規定之最高時速多少公里以上者，處新臺幣6,000～36,000元罰鍰，並當場禁止其駕駛：	(1)	40公里。	(2)	50公里。	(3)	60公里。	
90	3	汽車駕駛人駕駛營業大客車，因酒後駕駛應吊銷其駕駛執照，並：	(1)	2年內不得考領。	(2)	3年內不得考 領。	(3)	4年內不得考領。	
91	3	駕車於上坡路段使用二檔時，下坡應使用：	(1)	四檔。	(2)	三檔。	(3)	二檔。	
92	3	汽車下長坡時，最安全控制速度的方法，是使用：	(1)	腳煞車。	(2)	手煞車。	(3)	低速檔適時配合引擎煞車。	
93	1	下列敍述何者正確：	(1)	駕駛人、前座及小型車後座乘客均應繫妥安全帶。	(2)	起駛後才應顯示方向燈。	(3)	兒童須乘坐於小客車之前座。	
94	1	禁止停車路段，其禁止時間為每日之：	(1)	上午7時至晚間8時。	(2)	下午7時至上午8時。	(3)	全天24小時。	如有延長或縮短之必要時，應以標誌及附牌標示之。
95	3	禁止臨時停車路段，其禁止時間為每日之：	(1)	上午7時至晚間8 時。	(2)	下午7時至上午8時。	(3)	全天24小時。	如有縮短之必要時，應以標誌及附牌標示之。
96	3	禁止臨時停車路段：	(1)	禁止臨時停車，但可以停車。	(2)	禁止停車，但可以臨時停車。	(3)	不得臨時停車也不得停車。	
97	2	禁止停車路段：	(1)	禁止臨時停車，但可以停車。	(2)	禁止停車，但可以臨時停車。	(3)	不得停車也不得臨時停車。	
98	3	汽車可停車路段，若無停車位時:	(1)	可以併排停車。	(2)	可任意併排停車。	(3)	不得併排停車。	
99	1	汽車行駛至設有禁止迴車標誌、禁止左轉標誌，劃有分向限制線、禁止超車線或禁止變換車道線之路段：	(1)	不得迴車。	(2)	可以倒車。	(3)	無來車時可迴車。	
100	3	汽車駕駛人拆除消音器造成噪音，處罰鍰丶當場禁止其行駛丶吊扣汽車牌照6個月，於1年內再犯者，處：	(1)	吊銷駕照。	(2)	吊扣駕照 1個月。	(3)	吊扣駕照6個月。	
101	3	IMAGEIMAGEIMAGEp008_img01_xref37__DOT__png	(1)	禁止汽車進入。	(2)	無柵門鐵路平交道。	(3)	有柵門鐵路平交道。	
102	2	IMAGEIMAGEIMAGEp008_img02_xref38__DOT__png	(1)	狹路。	(2)	隧道。	(3)	狹橋。	
103	2	IMAGEIMAGEIMAGEp008_img03_xref40__DOT__png	(1)	險降坡。	(2)	碼頭、堤岸。	(3)	路滑。	
104	1	IMAGEIMAGEIMAGEp008_img04_xref42__DOT__png	(1)	靠右行駛。	(2)	單行道。	(3)	可以右轉。	
105	2	IMAGEIMAGEIMAGEp008_img05_xref43__DOT__png	(1)	禁止停車。	(2)	停車檢查。	(3)	禁止汽車進入。	
106	3	IMAGEIMAGEIMAGEp008_img06_xref45__DOT__png	(1)	禁止行人通行。	(2)	停車再開。	(3)	禁止任何車輛進入。	
107	3	IMAGEIMAGEIMAGEp009_img01_xref49__DOT__png	(1)	禁止行人通行。	(2)	禁止任何車輛進入。	(3)	禁止四輪以上汽車進 入。	
108	2	IMAGEIMAGEIMAGEp009_img02_xref51__DOT__png	(1)	禁止任何車輛進入。	(2)	禁止聯結車進入。	(3)	禁止大貨車及聯結 車進入。	
